{
  "api_version": "taskspec.dev/v1",
  "kind": "TaskPlan",
  "approved": true,
  "metadata": {
    "name": "pilot-native-envelope"
  },
  "units": [
    {
      "id": "T-20260914-pilot-contention-worker",
      "title": "Provide a local test worker: --version prints resource-worker/1; normal invocation remains alive until cancellation and exits cleanly on TERM",
      "goal": "Provide a local test worker: --version prints resource-worker/1; normal invocation remains alive until cancellation and exits cleanly on TERM. It must not change repository files or contact providers.",
      "effort": "S",
      "profile": "standard",
      "execution_backend": "claude",
      "required_tools": [
        "git",
        "bash",
        "python3"
      ],
      "depends_on": [],
      "touches_paths": [],
      "creates_paths": [
        "tests/fixtures/toolkit/resource-worker.sh"
      ],
      "do_not_touch": [
        "tests/fixtures/toolkit/pilot-issue.json",
        "tasks"
      ],
      "rollback": "Revert only this isolated candidate change.",
      "observability": "Retained provider output, evaluation result, and prospective event journal.",
      "agent": "any",
      "why": "Add an isolated end-to-end regression where disjoint file changes claim one exclusive resource, a second run refuses the live conflict, and the resource becomes available after cancellation. Preserve one lease authority and target branch state.",
      "context": "Provide a local test worker: --version prints resource-worker/1; normal invocation remains alive until cancellation and exits cleanly on TERM. It must not change repository files or contact providers.",
      "source_note": "tests/fixtures/toolkit/pilot-issue.json",
      "behaviors": [
        {
          "id": "B-1",
          "given": "the registered repository issue and fixed authorized scope",
          "when": "the bounded implementation is independently evaluated",
          "then": "the declared behavior passes without modifying unrelated files or promoting reported evidence"
        },
        {
          "id": "B-2",
          "given": "the recorded evidence and authorization boundary",
          "when": "the candidate is checked",
          "then": "source evidence is unchanged and no unrelated write is present"
        }
      ],
      "anti_patterns": [
        "Do not modify the evaluator or authorize additional work."
      ],
      "evals": [
        {
          "id": "eval_1",
          "description": "Independent behavioral proof for contention-worker",
          "command": "/Users/luanmorenomaciel/GitHub/task-spec/.taskspec/runtime/decompose/bin/python /Users/luanmorenomaciel/GitHub/task-spec/tests/evals/toolkit/evaluate_issue.py contention-worker --root .",
          "verifies": [
            "B-1"
          ],
          "terminal": true,
          "expected_duration_sec": 120
        },
        {
          "id": "eval_2",
          "description": "Declared write surface only",
          "command": "/Users/luanmorenomaciel/GitHub/task-spec/.taskspec/runtime/decompose/bin/python /Users/luanmorenomaciel/GitHub/task-spec/tests/evals/toolkit/evaluate_issue.py write-boundary --root .",
          "verifies": [
            "B-2"
          ],
          "terminal": true,
          "expected_duration_sec": 120
        },
        {
          "id": "eval_3",
          "description": "Registered issue evidence is unchanged",
          "command": "/Users/luanmorenomaciel/GitHub/task-spec/.taskspec/runtime/decompose/bin/python /Users/luanmorenomaciel/GitHub/task-spec/tests/evals/toolkit/evaluate_issue.py source-integrity --root .",
          "verifies": [
            "B-2"
          ],
          "terminal": true,
          "expected_duration_sec": 120
        }
      ]
    },
    {
      "id": "T-20260914-pilot-contention",
      "title": "Add an isolated end-to-end regression where disjoint file changes claim one exclusive resource, a second run refuses the live conflict, and the resource becomes available after cancellation",
      "goal": "Add an isolated end-to-end regression where disjoint file changes claim one exclusive resource, a second run refuses the live conflict, and the resource becomes available after cancellation. Preserve one lease authority and target branch state. Use tests/fixtures/toolkit/resource-worker.sh for the held attempt. Print TOOLKIT_RESOURCE_CONTENTION=PASS only after the live resource refusal, cancellation/reuse, and unchanged target assertions pass. Compile the helper from this repository with its VERSION; do not use an installed helper from another checkout.",
      "effort": "S",
      "profile": "standard",
      "execution_backend": "claude",
      "required_tools": [
        "git",
        "bash",
        "python3"
      ],
      "depends_on": [
        "T-20260914-pilot-contention-worker"
      ],
      "touches_paths": [],
      "creates_paths": [
        "tests/test-toolkit-resource-contention.sh"
      ],
      "do_not_touch": [
        "tests/fixtures/toolkit/pilot-issue.json",
        "tasks"
      ],
      "rollback": "Revert only this isolated candidate change.",
      "observability": "Retained provider output, evaluation result, and prospective event journal.",
      "agent": "any",
      "why": "Add an isolated end-to-end regression where disjoint file changes claim one exclusive resource, a second run refuses the live conflict, and the resource becomes available after cancellation. Preserve one lease authority and target branch state.",
      "context": "Add an isolated end-to-end regression where disjoint file changes claim one exclusive resource, a second run refuses the live conflict, and the resource becomes available after cancellation. Preserve one lease authority and target branch state. Use tests/fixtures/toolkit/resource-worker.sh for the held attempt. Print TOOLKIT_RESOURCE_CONTENTION=PASS only after the live resource refusal, cancellation/reuse, and unchanged target assertions pass. Compile the helper from this repository with its VERSION; do not use an installed helper from another checkout.",
      "source_note": "tests/fixtures/toolkit/pilot-issue.json",
      "behaviors": [
        {
          "id": "B-1",
          "given": "the registered repository issue and fixed authorized scope",
          "when": "the bounded implementation is independently evaluated",
          "then": "the declared behavior passes without modifying unrelated files or promoting reported evidence"
        },
        {
          "id": "B-2",
          "given": "the recorded evidence and authorization boundary",
          "when": "the candidate is checked",
          "then": "source evidence is unchanged and no unrelated write is present"
        }
      ],
      "anti_patterns": [
        "Do not modify the evaluator or authorize additional work."
      ],
      "evals": [
        {
          "id": "eval_1",
          "description": "Independent behavioral proof for contention",
          "command": "/Users/luanmorenomaciel/GitHub/task-spec/.taskspec/runtime/decompose/bin/python /Users/luanmorenomaciel/GitHub/task-spec/tests/evals/toolkit/evaluate_issue.py contention --root .",
          "verifies": [
            "B-1"
          ],
          "terminal": true,
          "expected_duration_sec": 120
        },
        {
          "id": "eval_2",
          "description": "Declared write surface only",
          "command": "/Users/luanmorenomaciel/GitHub/task-spec/.taskspec/runtime/decompose/bin/python /Users/luanmorenomaciel/GitHub/task-spec/tests/evals/toolkit/evaluate_issue.py write-boundary --root .",
          "verifies": [
            "B-2"
          ],
          "terminal": true,
          "expected_duration_sec": 120
        },
        {
          "id": "eval_3",
          "description": "Registered issue evidence is unchanged",
          "command": "/Users/luanmorenomaciel/GitHub/task-spec/.taskspec/runtime/decompose/bin/python /Users/luanmorenomaciel/GitHub/task-spec/tests/evals/toolkit/evaluate_issue.py source-integrity --root .",
          "verifies": [
            "B-2"
          ],
          "terminal": true,
          "expected_duration_sec": 120
        }
      ]
    }
  ]
}
