{
  "api_version": "taskspec.dev/v1",
  "kind": "TaskPlan",
  "approved": true,
  "metadata": {
    "name": "pilot-native-envelope"
  },
  "units": [
    {
      "id": "T-20260914-pilot-small-fix",
      "title": "Accept valid stdin JSON and reject malformed stdin with the same typed errors as file input; preserve file validation",
      "goal": "Accept valid stdin JSON and reject malformed stdin with the same typed errors as file input; preserve file validation.",
      "effort": "S",
      "profile": "standard",
      "execution_backend": "claude",
      "required_tools": [
        "git",
        "bash",
        "python3"
      ],
      "depends_on": [],
      "touches_paths": [
        "src/recipe/recipes.py"
      ],
      "creates_paths": [],
      "do_not_touch": [
        "tests/fixtures/toolkit/pilot-issue.json",
        "tasks"
      ],
      "rollback": "Revert only this isolated candidate change.",
      "observability": "Retained provider output, evaluation result, and prospective event journal.",
      "agent": "any",
      "why": "Accept valid stdin JSON and reject malformed stdin with the same typed errors as file input; preserve file validation.",
      "context": "Accept valid stdin JSON and reject malformed stdin with the same typed errors as file input; preserve file validation.",
      "source_note": "tests/fixtures/toolkit/pilot-issue.json",
      "behaviors": [
        {
          "id": "B-1",
          "given": "the registered repository issue and fixed authorized scope",
          "when": "the bounded implementation is independently evaluated",
          "then": "the declared behavior passes without modifying unrelated files or promoting reported evidence"
        },
        {
          "id": "B-2",
          "given": "the recorded evidence and authorization boundary",
          "when": "the candidate is checked",
          "then": "source evidence is unchanged and no unrelated write is present"
        }
      ],
      "anti_patterns": [
        "Do not modify the evaluator or authorize additional work."
      ],
      "evals": [
        {
          "id": "eval_1",
          "description": "Independent behavioral proof for small-fix",
          "command": "/Users/luanmorenomaciel/GitHub/task-spec/.taskspec/runtime/decompose/bin/python /Users/luanmorenomaciel/GitHub/task-spec/tests/evals/toolkit/evaluate_issue.py small-fix --root .",
          "verifies": [
            "B-1"
          ],
          "terminal": true,
          "expected_duration_sec": 120
        },
        {
          "id": "eval_2",
          "description": "Declared write surface only",
          "command": "/Users/luanmorenomaciel/GitHub/task-spec/.taskspec/runtime/decompose/bin/python /Users/luanmorenomaciel/GitHub/task-spec/tests/evals/toolkit/evaluate_issue.py write-boundary --root .",
          "verifies": [
            "B-2"
          ],
          "terminal": true,
          "expected_duration_sec": 120
        },
        {
          "id": "eval_3",
          "description": "Registered issue evidence is unchanged",
          "command": "/Users/luanmorenomaciel/GitHub/task-spec/.taskspec/runtime/decompose/bin/python /Users/luanmorenomaciel/GitHub/task-spec/tests/evals/toolkit/evaluate_issue.py source-integrity --root .",
          "verifies": [
            "B-2"
          ],
          "terminal": true,
          "expected_duration_sec": 120
        }
      ]
    }
  ]
}
